{
  "schema_version": "1.0.0",
  "id": "lpic1.101.1.usb-backup-authorization-recovery",
  "title_fr": "Réactiver un support USB de sauvegarde non autorisé",
  "brief_fr": "Un disque USB de sauvegarde ne peut plus être lu par la VM : son emplacement de montage est vide, alors que le support est toujours connecté et que ses données sont intactes. Identifie pourquoi le système ne l’expose plus comme périphérique utilisable, puis rétablis l’accès au volume sans formatage et sans toucher au disque système.",
  "success_criteria_fr": [
    "Le support USB réapparaît parmi les périphériques du noyau et est autorisé sur son port d'origine.",
    "Le contrôleur PCI USB, le périphérique USB et le volume disque identifié correspondent au même matériel virtuel.",
    "Le volume de sauvegarde d'origine est remonté et son manifeste est lisible sans modification."
  ],
  "debrief_fr": "Sur une VM Q35, le contrôleur xHCI est un périphérique PCI et expose des équipements USB via le noyau. lsusb, lspci, les propriétés udev et les chemins sous /sys permettent de relier contrôleur, port USB et disque. L'attribut authorized du périphérique USB contrôle sa connexion logique ; le réactiver permet au pilote usb-storage et à udev de rendre le volume de nouveau accessible. La source de l'exercice est un disque virtuel privé, jamais un périphérique USB physique de l'hôte.",
  "objective_ids": [
    "101.1"
  ],
  "concept_ids": [
    "lpic1.101.1.bus-pci-et-usb",
    "lpic1.101.1.manipulation-des-peripheriques-usb"
  ],
  "labels": [
    "lpic-required",
    "modern-practice",
    "scenario-accepted"
  ],
  "estimated_minutes": 15,
  "practice_context": "101.1.usb-backup-authorization-recovery",
  "environment": {
    "backend": "libvirt",
    "image_ref": "fedora-44-x86_64-v2",
    "distribution": "fedora",
    "network": "none",
    "capability_profile": "full-machine",
    "writable_guest_paths": [],
    "machine": {
      "firmware": "uefi",
      "extra_disks": [
        {
          "id": "usb-backup",
          "size_mb": 256,
          "bus": "usb"
        }
      ]
    }
  },
  "resources": {
    "memory_mb": 1024,
    "cpu_percent": 100,
    "pids": 128,
    "timeout_seconds": 1800
  },
  "setup": {
    "execution_scope": "sandbox",
    "script_ref": "setup.sh"
  },
  "checks": [
    {
      "type": "command-exit",
      "argv": [
        "/usr/bin/bash",
        "-lc",
        "set -e; usbdev=$(cat /var/lib/lpic-usb-rescue/device-path); test -d \"$usbdev\"; test -f \"$usbdev/idVendor\"; test -f \"$usbdev/idProduct\"; test \"$(cat \"$usbdev/authorized\")\" = 1; test -b /dev/sda; [[ \"$(readlink -f /sys/class/block/sda/device)\" == \"$usbdev/\"* ]]"
      ],
      "expected_exit": 0,
      "concept_ids": [
        "lpic1.101.1.bus-pci-et-usb",
        "lpic1.101.1.manipulation-des-peripheriques-usb"
      ]
    },
    {
      "type": "command-exit",
      "argv": [
        "/usr/bin/bash",
        "-lc",
        "set -e; usbdev=$(cat /var/lib/lpic-usb-rescue/device-path); [[ \"$usbdev\" == *\"/pci\"* ]]; test \"$(lsblk -dn -o TRAN /dev/sda)\" = usb; udevadm info --query=property --name=/dev/sda | grep -Fxq 'ID_BUS=usb'; vendor=$(cat \"$usbdev/idVendor\"); product=$(cat \"$usbdev/idProduct\"); lsusb -d \"$vendor:$product\" | grep -q .; lspci | grep -Eiq 'USB controller'"
      ],
      "expected_exit": 0,
      "concept_ids": [
        "lpic1.101.1.bus-pci-et-usb",
        "lpic1.101.1.manipulation-des-peripheriques-usb"
      ]
    },
    {
      "type": "command-exit",
      "argv": [
        "/usr/bin/bash",
        "-lc",
        "set -e; mountpoint -q /srv/lpic-usb-backup; test \"$(findmnt -n -o UUID --target /srv/lpic-usb-backup)\" = \"$(blkid -s UUID -o value /dev/sda)\"; test \"$(cat /srv/lpic-usb-backup/manifest.txt)\" = 'usb-backup=preserve-78'; test \"$(blkid -s LABEL -o value /dev/sda)\" = LPICUSB78"
      ],
      "expected_exit": 0,
      "concept_ids": [
        "lpic1.101.1.manipulation-des-peripheriques-usb"
      ]
    }
  ],
  "hint_ids": [
    "lpic1.101.1.usb-backup-authorization-recovery.hint-1",
    "lpic1.101.1.usb-backup-authorization-recovery.hint-2",
    "lpic1.101.1.usb-backup-authorization-recovery.hint-3",
    "lpic1.101.1.usb-backup-authorization-recovery.hint-4"
  ],
  "reference_solution_ref": "reference-solution.sh",
  "reset_policy": "disposable"
}
