{
  "schema_version": "1.0.0",
  "id": "lpic1.103.5.transfer-operator-session",
  "title_fr": "Conduire une relève de maintenance",
  "brief_fr": "Un opérateur prend la relève d’une maintenance sans interrompre le traitement en cours. Le programme reload-worker doit recevoir une demande de rechargement tout en restant actif ; conserve son état initial dans /run/lpic/maintenance-inspection. Vérifie également qu’une tâche de maintenance peut être suspendue, reprise en arrière-plan puis arrêtée proprement. À la fin, le traitement batch, un démon indépendant du terminal et une session de maintenance détachée nommée maintenance-ops doivent être disponibles au prochain opérateur.",
  "success_criteria_fr": [
    "Le service reload-worker a reçu sa demande de rechargement sans être interrompu.",
    "Le relevé /run/lpic/maintenance-inspection décrit le processus initial (PID, PPID, état, commande).",
    "La tâche de test a réellement été suspendue, reprise en arrière-plan et terminée proprement.",
    "Le batch et le démon restent actifs, et ce dernier ne dépend plus du terminal d’origine.",
    "La session de maintenance détachée maintenance-ops est disponible pour la relève."
  ],
  "debrief_fr": "Ce contexte exige à nouveau inspection et sélection précises des processus, puis un vrai cycle de job control dans un PTY : foreground, Ctrl-Z, jobs, bg et SIGTERM. Il ajoute un processus lancé avec &, un survivant nohup et une session tmux détachée. Le transfert n'est donc crédité que lorsque les sept concepts 103.5 ont une preuve observable dans ce second contexte.",
  "objective_ids": [
    "103.5"
  ],
  "concept_ids": [
    "lpic1.103.5.processus-avant-arriere-plan",
    "lpic1.103.5.jobs-du-shell",
    "lpic1.103.5.signaux",
    "lpic1.103.5.inspection-arbres-ressources",
    "lpic1.103.5.processus-survivant-a-la-session",
    "lpic1.103.5.selection-par-nom-pid",
    "lpic1.103.5.multiplexeurs-de-terminal"
  ],
  "labels": [
    "lpic-required",
    "modern-practice",
    "scenario-accepted"
  ],
  "estimated_minutes": 12,
  "practice_context": "operator-session",
  "environment": {
    "backend": "podman",
    "image_ref": "localhost/lpic-daily/fedora-phase1:1",
    "distribution": "fedora",
    "network": "none",
    "capability_profile": "process-lab",
    "writable_guest_paths": [
      "/run/lpic",
      "/usr/local/bin"
    ]
  },
  "resources": {
    "memory_mb": 256,
    "pids": 128,
    "timeout_seconds": 1200,
    "cpu_percent": 100
  },
  "setup": {
    "execution_scope": "sandbox",
    "script_ref": "setup.sh"
  },
  "checks": [
    {
      "type": "process-running",
      "match": "reload-worker",
      "concept_ids": [
        "lpic1.103.5.selection-par-nom-pid"
      ]
    },
    {
      "type": "file-content-regex",
      "path": "/run/lpic/reload-requested",
      "pattern": "^reload\\n?$",
      "concept_ids": [
        "lpic1.103.5.signaux",
        "lpic1.103.5.selection-par-nom-pid"
      ]
    },
    {
      "type": "command-exit",
      "argv": [
        "/usr/bin/bash",
        "-lc",
        "test -s /run/lpic/maintenance-inspection && grep -Eq \"^[[:space:]]*$(cat /run/lpic/reload-worker.pid)[[:space:]]+[0-9]+[[:space:]]+[A-Z]\" /run/lpic/maintenance-inspection && grep -q reload-worker /run/lpic/maintenance-inspection"
      ],
      "expected_exit": 0,
      "concept_ids": [
        "lpic1.103.5.inspection-arbres-ressources"
      ]
    },
    {
      "type": "file-content-regex",
      "path": "/run/lpic/maintenance-probe-background",
      "pattern": "^background\\n?$",
      "concept_ids": [
        "lpic1.103.5.processus-avant-arriere-plan",
        "lpic1.103.5.jobs-du-shell"
      ]
    },
    {
      "type": "file-content-regex",
      "path": "/run/lpic/maintenance-probe-stopped",
      "pattern": "^stopped\\n?$",
      "concept_ids": [
        "lpic1.103.5.jobs-du-shell",
        "lpic1.103.5.signaux"
      ]
    },
    {
      "type": "file-content-regex",
      "path": "/run/lpic/maintenance-probe-continued",
      "pattern": "^continued\\n?$",
      "concept_ids": [
        "lpic1.103.5.processus-avant-arriere-plan",
        "lpic1.103.5.signaux"
      ]
    },
    {
      "type": "file-content-regex",
      "path": "/run/lpic/maintenance-probe-terminated",
      "pattern": "^terminated\\n?$",
      "concept_ids": [
        "lpic1.103.5.signaux"
      ]
    },
    {
      "type": "process-absent",
      "match": "/usr/local/bin/lpic-maintenance-job-probe",
      "concept_ids": [
        "lpic1.103.5.signaux"
      ]
    },
    {
      "type": "process-running",
      "match": "batch-worker",
      "concept_ids": [
        "lpic1.103.5.processus-avant-arriere-plan"
      ]
    },
    {
      "type": "process-running",
      "match": "handoff-daemon",
      "concept_ids": [
        "lpic1.103.5.processus-survivant-a-la-session"
      ]
    },
    {
      "type": "command-exit",
      "argv": [
        "/usr/bin/tmux",
        "has-session",
        "-t",
        "maintenance-ops"
      ],
      "expected_exit": 0,
      "concept_ids": [
        "lpic1.103.5.multiplexeurs-de-terminal"
      ]
    }
  ],
  "hint_ids": [
    "lpic1.103.5.transfer-operator-session.hint-1",
    "lpic1.103.5.transfer-operator-session.hint-2",
    "lpic1.103.5.transfer-operator-session.hint-3",
    "lpic1.103.5.transfer-operator-session.hint-4"
  ],
  "reference_solution_ref": "reference-solution.sh",
  "reset_policy": "disposable",
  "requires_persistent_shell": true
}
