{
  "schema_version": "1.0.0",
  "id": "lpic1.102.5.offline-zypper-repository-recovery",
  "title_fr": "Rétablir un collecteur openSUSE depuis un dépôt local",
  "brief_fr": "Sur un serveur openSUSE isolé du réseau, le collecteur d'archives n'est plus disponible après une restauration. Le dépôt de maintenance local existe toujours, mais Zypper ne parvient plus à fournir le paquet ni sa dépendance. Remets le collecteur en état à partir des paquets déjà présents, sans activer d'accès réseau ni copier les exécutables à la main.",
  "success_criteria_fr": [
    "Le dépôt local est exploitable par Zypper sans connexion externe.",
    "Le collecteur et son composant d'exécution sont installés et leurs dépendances sont satisfaites.",
    "La commande du collecteur fonctionne et appartient à un paquet RPM installé."
  ],
  "debrief_fr": "Sur openSUSE, Zypper pilote les dépôts et les transactions de paquets RPM. `zypper lr -u`, `zypper refresh` et `zypper install` permettent de diagnostiquer une source erronée et de résoudre les dépendances. La base RPM reste l'inventaire des paquets ; un exécutable copié manuellement ne remplace pas une installation gérée. Ici, les RPM d'exercice sont locaux et non signés ; en production, il faut vérifier la confiance des dépôts et les signatures.",
  "objective_ids": [
    "102.5"
  ],
  "concept_ids": [
    "lpic1.102.5.workflow-zypper-opensuse"
  ],
  "labels": [
    "lpic-required",
    "modern-practice",
    "scenario-accepted"
  ],
  "estimated_minutes": 15,
  "practice_context": "102.5.offline-zypper-repository-recovery",
  "environment": {
    "backend": "libvirt",
    "image_ref": "opensuse-leap-16.0-x86_64-v2",
    "distribution": "opensuse",
    "network": "none",
    "capability_profile": "full-machine",
    "writable_guest_paths": [],
    "machine": {
      "firmware": "uefi"
    }
  },
  "resources": {
    "memory_mb": 1024,
    "cpu_percent": 100,
    "pids": 128,
    "timeout_seconds": 2100
  },
  "setup": {
    "execution_scope": "sandbox",
    "script_ref": "setup.sh"
  },
  "checks": [
    {
      "type": "command-exit",
      "argv": [
        "/usr/bin/bash",
        "-lc",
        "test -s /srv/lpic-zypp-repo/repodata/repomd.xml && zypper --non-interactive --no-gpg-checks refresh lpic-maint >/dev/null 2>&1 && zypper --non-interactive --no-gpg-checks --no-refresh search --repo lpic-maint --match-exact lpic-archive-agent | grep -Fq lpic-archive-agent"
      ],
      "expected_exit": 0,
      "concept_ids": [
        "lpic1.102.5.workflow-zypper-opensuse"
      ],
      "description_fr": "Le dépôt local openSUSE est utilisable avec Zypper."
    },
    {
      "type": "command-exit",
      "argv": [
        "/usr/bin/bash",
        "-lc",
        "rpm -q --quiet lpic-archive-agent && rpm -q --quiet lpic-archive-runtime && rpm -q --requires lpic-archive-agent | grep -Fq 'lpic-archive-runtime' && rpm -V lpic-archive-agent && rpm -V lpic-archive-runtime"
      ],
      "expected_exit": 0,
      "concept_ids": [
        "lpic1.102.5.workflow-zypper-opensuse"
      ],
      "description_fr": "Le collecteur et son runtime RPM sont installés et intègres."
    },
    {
      "type": "command-exit",
      "argv": [
        "/usr/bin/bash",
        "-lc",
        "test \"$(/usr/local/bin/lpic-archive-agent)\" = 'zypp-agent=ready' && test \"$(rpm -qf --qf '%{NAME}' /usr/local/bin/lpic-archive-agent)\" = 'lpic-archive-agent'"
      ],
      "expected_exit": 0,
      "concept_ids": [
        "lpic1.102.5.workflow-zypper-opensuse"
      ],
      "description_fr": "Le collecteur fonctionne et son exécutable appartient au bon paquet."
    }
  ],
  "hint_ids": [
    "lpic1.102.5.offline-zypper-repository-recovery.hint-1",
    "lpic1.102.5.offline-zypper-repository-recovery.hint-2",
    "lpic1.102.5.offline-zypper-repository-recovery.hint-3",
    "lpic1.102.5.offline-zypper-repository-recovery.hint-4"
  ],
  "reference_solution_ref": "reference-solution.sh",
  "reset_policy": "disposable"
}
